{
  "schemaVersion": "1.0.0",
  "observationId": "aws-ecs-20260722221000",
  "source": "aws-ecs",
  "observedAt": "2026-07-22T22:10:00Z",
  "region": "us-west-1",
  "accountId": "123456789012",
  "services": [
    {
      "serviceId": "aegentix-govops",
      "cluster": "AEGENTIX-Cluster",
      "clusterArn": "arn:aws:ecs:us-west-1:123456789012:cluster/AEGENTIX-Cluster",
      "serviceArn": "arn:aws:ecs:us-west-1:123456789012:service/AEGENTIX-Cluster/aegentix-govops",
      "status": "ACTIVE",
      "launchType": "FARGATE",
      "desiredCount": 1,
      "runningCount": 1,
      "pendingCount": 0,
      "taskDefinition": "arn:aws:ecs:us-west-1:123456789012:task-definition/aegentix-govops:1",
      "platformVersion": "1.4.0",
      "deployments": [],
      "networkConfiguration": {},
      "loadBalancers": [],
      "containers": [
        {
          "name": "government-ops-spine",
          "image": "123456789012.dkr.ecr.us-west-1.amazonaws.com/aegentix-government-ops-spine:latest",
          "essential": true,
          "ports": [{"containerPort": 8099, "hostPort": 8099, "protocol": "tcp"}],
          "logConfiguration": {"logDriver": "awslogs"}
        }
      ],
      "tasks": [
        {
          "taskArn": "arn:aws:ecs:us-west-1:123456789012:task/AEGENTIX-Cluster/example",
          "lastStatus": "RUNNING",
          "desiredStatus": "RUNNING",
          "healthStatus": "UNKNOWN",
          "startedAt": "2026-07-22T18:04:00Z",
          "stoppedReason": null,
          "containers": [
            {
              "name": "government-ops-spine",
              "image": "123456789012.dkr.ecr.us-west-1.amazonaws.com/aegentix-government-ops-spine:latest",
              "imageDigest": "sha256:example",
              "lastStatus": "RUNNING",
              "healthStatus": "UNKNOWN",
              "exitCode": null
            }
          ]
        }
      ]
    }
  ]
}
